subreddit,selftext,title,created_date
wallstreetbets,,GME wishing they’d thought of it first.,2022-08-06
wallstreetbets,"Wasn’t this supposed to go down?  I thought you guys said it was going down?  WTF?  Why’s it going up?  

You guys are definitely in the right place.",Hmmmmmmmmm,2022-08-06
wallstreetbets,[removed],MEGL,2022-08-06
wallstreetbets,Not I. Im not sure why anyone would sell if you’ve held it that long to begin with. Let it play out. There was thousands of you bashing and then here it is today up on the day. Not cut in half like most of you thought. Anyway enjoy the weekend numb nuts,Who is guilty of selling AMC this morning and why?,2022-08-06
wallstreetbets,,"Not as much as some of you other retards, but its everything i have🚀🚀🚀",2022-08-06
wallstreetbets,,Every time an ape gets adopted on this subreddit,2022-08-06
wallstreetbets,,When going full retard goes right. BBBY FTW,2022-08-06
wallstreetbets,2022 ain’t over,LFG!,2022-08-06
wallstreetbets,,Sign from the meme gods I should go all in. Shares filled at 7.6699 so I bought calls too and they filled in lots at 6&amp;9 now imma buy more shares fuck it! 🚀🚀,2022-08-06
wallstreetbets,[removed],Let’s break the short! I want to smash BBBY's short selling. Like the game stop or the AMC crisis. How about pumping for the short squeeze from next Monday?,2022-08-06
wallstreetbets,[removed],Who’s guilty of selling all their AMC shares this morning after $APE announcement? Not I you retards,2022-08-06
wallstreetbets,[removed],I want to smash BBBY's short selling. Like the game stop or the AMC. How about pumping for the short squeeze from next Monday?,2022-08-06
wallstreetbets,,Made sure i bought the top of $BBBY today,2022-08-06
wallstreetbets,"First off, fuck off. 
Can anyone vouch or is currently utilizing that this is an adequate method for long term buys? Using FinViz, and after applying the filters I’m seeing mostly strong buys. What’s another filter you guys use to pin down the potential and thriving?


Buy and Holds

Mkt cap &gt; 50mm
EPS growth next 5 years &gt; 10%
ROE &gt; 15%
PEG &gt; 1
Current Ratio &gt; 1.5
Price above SMA20
*Beta &gt; 1.5",Long Term Filter Settings,2022-08-06
wallstreetbets,"Whenever this guy comes on CNBC, he always makes a case for new ATH no matter where we are in the business cycle. What do u guys think? He called for ATH in Feb. 

https://www.youtube.com/watch?v=pGTLjx3bYW4&amp;ab_channel=CNBCTelevision",Permabull Tom lee in Feb 2022,2022-08-06
wallstreetbets,,Who knew?,2022-08-06
wallstreetbets,,Ape Math,2022-08-06
wallstreetbets,Wrong prices graph on Revoulet?,Any idea?,2022-08-06
wallstreetbets,,This once my whole portfolio,2022-08-06
wallstreetbets,,Slap it! We haven’t even begun!,2022-08-06
wallstreetbets,,Holding this position for ants to see how it does eod! Any advice?,2022-08-06
wallstreetbets,"So here we are it looks like we are starting the downward slope of this rounded top (double or maybe 3x test of $416.Xx)

100% this week was filled with hawkish FED and bad econ data to support FED pivot.

TIME TO NO LONGER PLAY SPY CALLS. Time to find spot and go BIG ON SPY PUTS. IMO. NFA 

Market 100% will look to pare back some gains ahead of CPI next week. Maybe $400/405 is a nice mid level (maybe Monday??)

After this the bulls can come back in if CPI is like 6-7% YoY, BUT MORE IMPORTANTLY look at the MONTHLY MoM. If Core CPI is flat, higher or very small decrease - FED HAS TO tighten!

Meaning this is not the end of inflation fears,.. maybe another month or 2.

Bears come back in and we move to $390ish or lower!",BEAR MARKET RALLY - OVER,2022-08-06
wallstreetbets,,He's not even trying to hide it. Bamboozled.,2022-08-06
wallstreetbets,,To the moon 🚀,2022-08-06
wallstreetbets,[removed],"Permabull Tom Lee's prediction on Feb 28, 2022",2022-08-06
wallstreetbets,,How to make money: spend all dividends on OTM Leaps for tax purposes (win/win),2022-08-06
wallstreetbets,,For all the degenerate doomsday preppers like myself,2022-08-06
wallstreetbets,,Feeling good about AIV,2022-08-06
wallstreetbets,[removed],Why is bbig halted on some exchanges?,2022-08-06
wallstreetbets,,Close this now or at end of day?,2022-08-06
wallstreetbets,[removed],"Guys, should I close this tiny position for ants? or wait until EOD?",2022-08-06
wallstreetbets,[removed],https://www.reddit.com/r/ai_trading/comments/wgj48r/stock_pattern_three_rising_valleys_svfd_on_july/?utm_source=share&amp;utm_medium=ios_app&amp;utm_name=iossmf,2022-08-06
wallstreetbets,,"Leavin on a jet plane, don’t know when I’ll be back again",2022-08-06
wallstreetbets,"Honestly, I don't get it. I think the business model is attracitve, since I bougt a car via Carvana before. When share was down to $29, I thought it is cheap enough, so I bought 1000 shares, but soon after it was down to 19 something. So I cut lose of 500 shares. Now it is over 40 becuase of a so-so earning report. 

https://preview.redd.it/cylogktt3xf91.png?width=1918&amp;format=png&amp;auto=webp&amp;s=b6ff10f7151d14a904cd649667faa0ae76d8de88

Cloud this be new GME? I doubt it. The Astec socre is just 5 right now, which is far from triggering a short squeez. But somehow people is buying it crazy. Yes, 300+ a share for a online car dealer is absolutely a BS, but really 20 bucks? That is also not right as well. For that I see a potenial profit. Just not realizing it will be this fast. 

My DCF model predict the price of CVNA should around 40 bucks a share by year end. This is considering the used car market is not going to cool off for next 6 to 12 month, thus higher EBITA exit multiple. Eventhough the price surge had cooling off, but price still remains high. 

[US CPI Cat, Used Cars and Trucks. Still a 10&amp;#37; in-crease Y\/Y](https://preview.redd.it/5392kr7k6xf91.png?width=855&amp;format=png&amp;auto=webp&amp;s=59df824ff6736805c3f0c432d7b8fcad73b9f948)

But rightnow, this stock has nothing to do with fundamental, it is just another casino that open for business.",CVNA Gain Almost 100% in Last 30 Days,2022-08-06
wallstreetbets,,That didn’t age well lol,2022-08-06
wallstreetbets,,Who likes to kiss Jim Cramer?,2022-08-06
wallstreetbets,[removed],MEGL,2022-08-06
wallstreetbets,,$BBBY more than 20% up today… What is the next station?,2022-08-06
wallstreetbets," Save Foods Inc (NASDAQ: SVFD) and its Israeli subsidiary Save Foods Ltd are innovative, dynamic companies dedicated to delivering integrated eco-friendly solutions for improved safety, freshness and quality, every step of the way from field to fork. Collaborating closely with growers, packers, food retailers and service providers around the globe, Save Foods develops new solutions, and its new treatments extend the shelf life of fresh produce, ensure its safety while reducing (and in some cases even eliminating) the use of the hazardous chemicals used today. The Company’s products do not leave toxic residues and reduce reliance on classical fungicides, lowering their concentration and residues. 

&amp;#x200B;

*Processing video t2kkoppx4xf91...*",Save Foods: Extending the Shelf Life of Fresh Produce with Innovative Technology,2022-08-06
wallstreetbets,,When someone asks if I was an OG in the BBBY short squeeze,2022-08-06
wallstreetbets," I don't see any discussion about it, but then I have NoClueWhatImDoingYet.  Am I missing something?

\#BYND - Beyond Meat Inc

Adding more content to the message because the moderator said it wasn't enough and rejected my post the first time. Perhaps this will help get my post posted. Perhaps not. Well in the mean time I hope that you are having a smashing day and get all the things you ever wished for in life.",Are you Apes causing BYND to move up 20% today on bad news because it 37% short positions?,2022-08-06
wallstreetbets,,Bbby news !,2022-08-06
wallstreetbets,,It is worse than anyone can imagine!,2022-08-06
wallstreetbets,,Fed‘s Pivot… was just a dream,2022-08-06
wallstreetbets,[removed],Are you Apes causing BYND to move up 20% today on bad news because it 37% short positions?,2022-08-06
wallstreetbets,,Feelin the vibes boys!,2022-08-05
wallstreetbets,,Me and my 3 shares to the moon🚀🚀🚀,2022-08-05
wallstreetbets,"The squeeze starts when short interest goes down and it has not.

Shorts are deep in the money, and may not start to cover until $25-$35 (unless they get scared).

I'd be stoked if the squeeze doesn't start till $35, it makes $500+ that much more possible.","BBBY squeeze HASN'T STARTED, stop saying it has.",2022-08-05
wallstreetbets,[removed],Join WallStreetSilver WSS for the #silversqueeze 🔝🧨💥🔥🎉🦅🕺🏻,2022-08-05
wallstreetbets,,"Move aside Hedgie rug pull, BBBY is here 🔥🚀",2022-08-05
wallstreetbets,"Call It a Royal Comeback

After the pandemic-related shutdown, Royal Caribbean has slowly built back its business. The company became operating-cash-flow positive in the second quarter and has seen demand bounce back to 2019 levels. 

While the last 2 1/2 years were certainly challenging, we have proven that our business and company are resilient. Our business is now fully back up and running, and our operating platform is larger and stronger than it has ever been,

Buying Endeavor was an opportunistic move to quickly expand a cash-generating part of the business. 

Normally, building a ship involves tying up capital -- generally borrowed capital -- to pay for an asset that won't add revenue until it can begin booking sailings.

In this case, RCL got an asset that immediately begin sailing for a price lower than it would have cost to build.

RCL stock is a solid good investment.

https://www.thestreet.com/investing/royal-caribbean-cruise-line-adds-daring-new-ship",Royal Caribbean adds new ship,2022-08-05
wallstreetbets,,I’m no meme slut but definitely got eyes on AMC here. My current play for full disclosure. So I guess I’m technically a bear. Interesting Tymz🦧🍿,2022-08-05
wallstreetbets,"I'm not too much of TA guy, especially when people post these crazy ass charts covered in lines that mean nothing, but I really like Bollinger Bands. They seem to be the exception to the ""TA is astrology"" argument, at least in my experience. I've seen a good amount of people make this same argument for RSI, MACD, etc. I like the math involved with them, which is why I enjoy using them. I see the power in fundamentals, but I don't know as much about finance as I do about math, so I try to get a good mix of both.

NFA and all that, just want some discussion on it. I see most people here prefer fundamental analysis, but I'm curious if you guys like to cross reference your fundamental findings with any technical indicators if/when you're trying to work out the probability of your position doing what you want it to.",Technical Analysis Discussion,2022-08-05
wallstreetbets,[removed],What do you think is the best monkeypox play?,2022-08-05
wallstreetbets,,BBBY at $42.0 just sounds right!,2022-08-05
wallstreetbets,,Me and my 3 shares to the moon🚀🚀🚀,2022-08-05
wallstreetbets,[removed],Waffle Up,2022-08-05
wallstreetbets,,Big ups to all the haters,2022-08-05
wallstreetbets,,Captain Gene working his second job to crush the hedgies,2022-08-05
wallstreetbets,,BBBY $100k YOLO,2022-08-05
wallstreetbets,,Short story of a retard,2022-08-05
wallstreetbets,,"Jim Cramer all in, Tesla falls! Print that money!",2022-08-05
wallstreetbets,[removed],Do i call or put BBBY?,2022-08-05
wallstreetbets,"Ya’ll doing me proud. 
Do me a favor and visit your local store and buy a bath mat - great for absorbing your baby batter when you jizz, because your wife is getting back door action by Giga Chad and you get to watch!",BBBY - Baby Battering Backdoor Yokels!,2022-08-05
wallstreetbets,"Guys if you want to know how it went for me you can see how big is my ass right now please ho to ""double anal BBC gang bang"" in PH, thanks",BBBY you can watch my ass fully open in PH,2022-08-05
wallstreetbets,Will BBBY be the next gamestop and if so. How much should i put into BBBY AND HOW LONG SHOULD I HOLD APES,BBBY shares,2022-08-05
wallstreetbets,,101% BBBY short interest link FINRA under Information tab,2022-08-05
wallstreetbets,,AMTD stock connected to another ipo MEGL? $amtd $megl,2022-08-05
wallstreetbets,Take a look at this tweet from the guy who called BBBY on the 29th – it’s now up almost 50% and will keep going. [Will Meade Tweet](https://twitter.com/realwillmeade/status/1555567014059581440?s=21&amp;t=F_fQsS2l_R8NTvt1IVV4BA),BBBY isn’t done just yet,2022-08-05
wallstreetbets,,There is no Fed pivot coming with a gain of 528K jobs vs 250K expected. Let's put that nonsensical narrative to rest.,2022-08-05
wallstreetbets,,"&lt;flex&gt; Only 12,112 to go. &lt;/flex&gt;",2022-08-05
wallstreetbets,,Why is this shit company going up lmao.,2022-08-05
wallstreetbets,,"if you dont know, now you know ...",2022-08-05
wallstreetbets,,Tesla to the Grave,2022-08-05
wallstreetbets,,BBBY isn’t done yet,2022-08-05
wallstreetbets,,Take a look at this post… '🔥🤩Upcoming Apple iPhone 14 update | iPhone 14 iPhone 14 Pro iPhone 14 Pro Max'.,2022-08-05
wallstreetbets,"&amp;#x200B;

https://preview.redd.it/wroknzcrzwf91.png?width=612&amp;format=png&amp;auto=webp&amp;s=b7739daa09d6195f16c9702f4d4c652f045691e1

He seemed sad that in his words “the Apes hate me.” While Cramer calls ‘em as he sees ‘em, he has always been fair to AMC and to me. Apes, it is time to kiss and make up 

hahah this guy is just too funny.","These AMC post can't get any worse, can they? Adam Aron...",2022-08-05
wallstreetbets,,Pinging off of the EMA 200 just as God intended,2022-08-05
wallstreetbets,"thing is halted but went from 4 to 50 on nothing

or at least it appears as such

so why are mods banning these posts and can anyone explain the price action?","wtf man, banning my posts re: hong kong ipo?",2022-08-05
wallstreetbets,"Is the market trend more accurate the more times it is repeated? For example, 3 inverted hammer lines in a row, and 1 inverted hammer line. 5 consecutive support level bounces and 2. Can you tell me the results with backtesting? Thanks?",Are more frequent market trends more effective?,2022-08-05
wallstreetbets,"Selling my 10,000 shares at 8.33 just an FYI for y’all, there will be a hurdle to pass at some point",BBBY,2022-08-05
wallstreetbets,Alright retards the spike in BBBY is only the beginning. The more we contribute the higher it will go. Bears will be screwed and i will bust a nut when WE reach the stars higher than GME,Game plan for BBBY,2022-08-05
wallstreetbets,[removed],AMTD connected to MEGL?,2022-08-05
wallstreetbets,,CVNA +30% A Day?,2022-08-05
wallstreetbets,[removed],"Ya'll on roll with these AMC post, so here's the best one yet.",2022-08-05
wallstreetbets,,"It's not much, but it's honest work 🚀🚀🚀",2022-08-05
wallstreetbets,,AMC Diluting More Shares Via “APE”,2022-08-05
wallstreetbets," Wall Street is feeling the most downbeat about the stock market in years, according to Bank of America analysts, and investors are getting ready for a recession.

In a Wednesday note, analysts wrote that the bank's Sell Side Indicator has plummeted to its lowest mark in over five years. The metric, which tracks the average recommended allocation of stocks by sell-side strategists, slipped 78 basis points in July.

""We have found that Wall Street's consensus equity allocation has historically been a reliable contrarian indicator,"" BofA analysts wrote. ""While the SSI does not catch every rally or decline in the stock market, the indicator has historically had some predictive capability with respect to subsequent 12-month S&amp;P 500 total returns.""

In the past, Wall Street's consensus equity allocation has been able to signal the opposite of what strategists recommend, meaning it's been a bearish indicator when analysts were bullish, and vice versa.

Now, the Sell Side Indicator has hovered in ""neutral"" territory through the first half of the year, but is now inching closer to ""Buy"" after recent declines.

Wall Street is feeling the most downbeat about the stock market in years, according to Bank of America analysts, and investors are getting ready for a recession.

In a Wednesday note, analysts wrote that the bank's Sell Side Indicator has plummeted to its lowest mark in over five years. The metric, which tracks the average recommended allocation of stocks by sell-side strategists, slipped 78 basis points in July.

""We have found that Wall Street's consensus equity allocation has historically been a reliable contrarian indicator,"" BofA analysts wrote. ""While the Sell Side Indicator does not catch every rally or decline in the stock market, the indicator has historically had some predictive capability with respect to subsequent 12-month S&amp;P 500 total returns.""

In the past, Wall Street's consensus equity allocation has been able to signal the opposite of what strategists recommend, meaning it's been a bearish indicator when analysts were bullish, and vice versa.

Now, the Sell Side Indicator has hovered in ""neutral"" territory through the first half of the year, but is now inching closer to ""Buy"" after recent declines.

[https://www.businessinsider.in/stock-market/news/wall-streets-confidence-in-the-stock-market-is-the-lowest-in-5-years-as-markets-price-in-an-80-chance-of-a-mild-recession-bank-of-america-says/articleshow/93330344.cms](https://www.businessinsider.in/stock-market/news/wall-streets-confidence-in-the-stock-market-is-the-lowest-in-5-years-as-markets-price-in-an-80-chance-of-a-mild-recession-bank-of-america-says/articleshow/93330344.cms)

Confidence in the stock market is the lowest in 5 years as markets price in an 80% chance of a mild recession, says Bank of America (BAC). The S&amp;P 500 (SPY) is up 13% from its June16th lows, the largest bounce of the year.

Are you currently bullish, bearish, or neutral?","Wall Street's confidence in the stock market is the lowest in 5 years as markets price in an 80% chance of a mild recession, Bank of America says",2022-08-05
wallstreetbets,,I just bought BBBY. I really think it’s a very good company. Especially with the lack of goods people are buying from everywhere and BBBY is way down and it also has a lot of short interest. So the possibility of a squeeze is really really high.,2022-08-05
wallstreetbets,[removed],$BBBY,2022-08-05
wallstreetbets,"Wall Street is feeling the most downbeat about the stock market in years, according to Bank of America analysts, and investors are getting ready for a recession.

In a Wednesday note, analysts wrote that the bank's Sell Side Indicator has plummeted to its lowest mark in over five years. The metric, which tracks the average recommended allocation of stocks by sell-side strategists, slipped 78 basis points in July.

""We have found that Wall Street's consensus equity allocation has historically been a reliable contrarian indicator,"" BofA analysts wrote. ""While the SSI does not catch every rally or decline in the stock market, the indicator has historically had some predictive capability with respect to subsequent 12-month S&amp;P 500 total returns.""

In the past, Wall Street's consensus equity allocation has been able to signal the opposite of what strategists recommend, meaning it's been a bearish indicator when analysts were bullish, and vice versa.

Now, the Sell Side Indicator has hovered in ""neutral"" territory through the first half of the year, but is now inching closer to ""Buy"" after recent declines.

Wall Street is feeling the most downbeat about the stock market in years, according to Bank of America analysts, and investors are getting ready for a recession.

In a Wednesday note, analysts wrote that the bank's Sell Side Indicator has plummeted to its lowest mark in over five years. The metric, which tracks the average recommended allocation of stocks by sell-side strategists, slipped 78 basis points in July.

""We have found that Wall Street's consensus equity allocation has historically been a reliable contrarian indicator,"" BofA analysts wrote. ""While the SSI does not catch every rally or decline in the stock market, the indicator has historically had some predictive capability with respect to subsequent 12-month S&amp;P 500 total returns.""

In the past, Wall Street's consensus equity allocation has been able to signal the opposite of what strategists recommend, meaning it's been a bearish indicator when analysts were bullish, and vice versa.

Now, the Sell Side Indicator has hovered in ""neutral"" territory through the first half of the year, but is now inching closer to ""Buy"" after recent declines.

[https://www.businessinsider.in/stock-market/news/wall-streets-confidence-in-the-stock-market-is-the-lowest-in-5-years-as-markets-price-in-an-80-chance-of-a-mild-recession-bank-of-america-says/articleshow/93330344.cms](https://www.businessinsider.in/stock-market/news/wall-streets-confidence-in-the-stock-market-is-the-lowest-in-5-years-as-markets-price-in-an-80-chance-of-a-mild-recession-bank-of-america-says/articleshow/93330344.cms)

Confidence in the stock market is the lowest in 5 years as markets price in an 80% chance of a mild recession, says Bank of America, $BAC. The S&amp;P 500 #SPY is up 13% from its June 16th lows, the largest bounce of the year.  

Are you currently bullish, bearish, or neutral?","Wall Street's confidence in the stock market is the lowest in 5 years as markets price in an 80% chance of a mild recession, Bank of America says",2022-08-05
wallstreetbets,[removed],Papa Elon says Cybertruck will now come out in 2049 (as depicted in Bladerunner 2049),2022-08-05
wallstreetbets,[removed],To everyone who bought puts on AMC for today,2022-08-05
wallstreetbets,,Papa Elon says Cybertruck will now come out in 2049 (as depicted in Bladerunner 2049),2022-08-05
wallstreetbets,,Did I just… buy low sell high? Am I doing something wrong?,2022-08-05
wallstreetbets,,"BBBY everyone been posting gains, thought I’d show them a true ape",2022-08-05
wallstreetbets,[removed],"Kraken energy is building off a solid momentum push for Uranium, particularly in Europe as thirst fro US Uranium grows 🔥🔥⚒️⚒️",2022-08-05
wallstreetbets," Hiring surged in July, with U.S. employers creating 528,000 jobs last month, the Labor Department said Friday. That far exceeded economist expectations for gains of 250,000 new jobs during the period. It was also a jump from the previous month, when businesses added 372,000 jobs despite the highest inflation in 40 years.

The unemployment rate ticked down to 3.5% from 3.6% in June, marking the lowest since February 2020, just before the COVID-19 pandemic erupted in the U.S. Before the latest payrolls report, the economy was adding roughly 450,000 jobs per month.

Both total nonfarm employment and the jobless rate have returned to their pre-pandemic levels.

The employment numbers underscore the resilience of the economy following two straight quarters of declining GDP, which is considered a hallmark of a recession. Despite this shrinking economic growth, hiring has remained robust as businesses continue to add jobs and hold onto their current workers amid strong consumer demand.

""This is a job market that just won't quit. It's challenging the rules of economics,"" said Becky Frankiewicz, chief commercial officer of hiring company ManpowerGroup in an email after the data was released. ""The economic indicators are signaling caution, yet American employers are signaling confidence.""

Read the full article: [https://www.cbsnews.com/news/jobs-report-528000-july-08-05-2022/](https://www.cbsnews.com/news/jobs-report-528000-july-08-05-2022/)

US unemployment rate in July decreased to 3.5%, the lowest since February 2020. This job growth is likely to weigh on stocks because it signals that the Fed can continue raising interest rates.

The S&amp;P 500 (SPY) is down 14% YTD. How do you see SPY will trade next week?","Hiring surged in July, with U.S. employers adding 528,000 jobs",2022-08-05
wallstreetbets,[removed],BBBY,2022-08-05
wallstreetbets,10 minutes of reading and Morgan Stanley locks out sales...  Let me guess. They bought them all themselves.,MEGL,2022-08-05
wallstreetbets,,to the moon,2022-08-05
wallstreetbets,[removed],ALL IN BABY!!,2022-08-05
wallstreetbets,,82 Shares of $BBBY LFG 101% short float,2022-08-05
wallstreetbets,,STONKS,2022-08-05
wallstreetbets,"Can someone explain just wtf happened with MEGL to go from 4 valuation to 50 valuation prior to any trades? I guess it was institutional and crime? like fuk man, I was poised to get this at 4 fukn dollars. like wtf man.",MEGL wtf,2022-08-05
wallstreetbets,,In for a few thousand shares $BBBY,2022-08-05
wallstreetbets,"So... I have no fucking idea what $BBBY is and does. As a matter of fact, I don't understand 80% of the garbage words regarding options. All I know is I want to get rich. I will, right?

https://preview.redd.it/po9yvi53vwf91.png?width=2858&amp;format=png&amp;auto=webp&amp;s=416a2472c26c09a6fec959cd923c3c13a34e4c51",Just aped some $BBBY,2022-08-05
wallstreetbets,,$BBBY GAIN PORN 100%+,2022-08-05
wallstreetbets,"I was looking at an article about hydrogen and its functions and I realized that this could be an energy alternative for the future. I analyzed and saw that electric cells work well for cars that are going to be electric, but what happens when we try to put those same cells in airplanes or transatlantic ships, the cost and space would increase significantly. Putting lithium batteries in a transatlantic ship ando airplanes would cost a lot and maintenance, the solution I see is to use hydrogen as fuel. what do you guys think?",hydrogen vs electric cells,2022-08-05
wallstreetbets,,Ready to retire,2022-08-05
