subreddit,selftext,title,created_date
wallstreetbets,Is it worth Gambling?,Thoughts On Cbay Stock,2022-08-06
wallstreetbets,,Got banned from AMC for posting about DRS by a mod who posted their own DRS on the sub,2022-08-06
wallstreetbets,,Got banned from AMC for mentioning DRS by a mod who posted their out DRS,2022-08-06
wallstreetbets,,B🚀 B🌙 B 🦍 Y,2022-08-06
wallstreetbets,,"Tried to post before but MODs took it down due market cap being too low - BBBY 🚀🚀🚀 One account is my individual and the other my, Roth IRA",2022-08-06
wallstreetbets,,Options are not for me,2022-08-06
wallstreetbets,,Hey this is Andrew Left from…,2022-08-06
wallstreetbets,,BBBY may fall to below $1 by Jan 2024,2022-08-06
wallstreetbets,"
Hello,

A friend said I should come here for help with investing. 
I have been working all summer and have $1000 dollars to invest. I want to make it turn into one million in one year or so, then I can buy a house to put my mum in. 
This is alot of money for me so tell me what to do with it and I'll do it.",Investing opportunity,2022-08-06
wallstreetbets,,$Bed Bath &amp; Beyond Inc Current SI of float is 101.06 % - based on the fintel and Yahoo Finance app. BBBY TO THE MOON AND BYOND 🚀🚀🚀🚀🚀🚀🚀🚀🚀 On top of that - from available Float - 91 % held by institutions. Can anyone check what is utilization ratio? If institutions BBBY shares available for short?,2022-08-06
wallstreetbets,,$Bed Bath &amp; Beyond Inc Current SI of float is 101.06 % - based on the fintel and Yahoo Finance app. BBBY TO THE MOON AND BYOND 🚀🚀🚀🚀🚀🚀🚀🚀🚀,2022-08-06
wallstreetbets,"I wanna rip my hair out. I slept in this morning and missed the IPO of $MEGL. If I bought as much as I planned to, I would’ve had 50,000 in profit. But now I have 0.

Instead, Im gonna go balls-in on Forza X1. I haven’t seen a lot of publicity regarding it, but its IPO looks promising.

I’ll post the following week with how much I made, or more likely lost.","Got fucked by MEGL, All in on Forza X1",2022-08-06
wallstreetbets,,It was a true pleasure interneting with you all. See you on the other side. [VIX 2008 vs today],2022-08-06
wallstreetbets,[removed],MEGL Puts 💪,2022-08-06
wallstreetbets,,$BBBY$ 11K shares - off we go!,2022-08-06
wallstreetbets,"Our chairman, founder, and CEO (ryan cohen) has led this company bravely against the SHF to bring us into a new enlightened age of bliss.

the NFT market place is operating FOR FREE, but generating over A THOUSAND DOLLARS of revenue per day.

I just have to appluad him for such a feat.",Gamestop's revolutionary NFT marketplace is printing FREE money for the company,2022-08-06
wallstreetbets,[removed],How's everyone saying SI over 100%$BBBY? only 46%!,2022-08-06
wallstreetbets,,Thinking about liquidating my portfolio… literally,2022-08-06
wallstreetbets,,Bed bath and BEYOND with a side of GME 🚀🚀🚀,2022-08-06
wallstreetbets,,if you're trading with cramer then you're...,2022-08-06
wallstreetbets,[removed],The fate of all Ponzi 's,2022-08-06
wallstreetbets,Near Purdue University,Which one of you degenerates is this?,2022-08-06
wallstreetbets,"I can't believe you would pump and dump behind my back? That's uncalled for....

https://news.yahoo.com/obscure-hong-kong-tech-company-221032068.html",You guys did this behind my back?,2022-08-06
wallstreetbets," *Please note GameStop has already distributed the shares of common stock required for the stock dividend to its transfer agent, which has confirmed it subsequently distributed the appropriate number of shares of common stock to DTC for allocation to brokerage firms and other participants.* 

&amp;#x200B;

[https://www.reddit.com/r/wallstreetbets/comments/wf16lq/heng\_seng\_bank\_said\_not\_received\_dividend\_from/](https://www.reddit.com/r/wallstreetbets/comments/wf16lq/heng_seng_bank_said_not_received_dividend_from/)

Some You speak it is just a fking split , OMG STUPID",GME confirmed has distributed the shares of common stock!!!!!!!!! It means my Hang Seng Bank did a wrong thing,2022-08-06
wallstreetbets,"Basically a buddy of mine lost 5500. it’s
really getting to him. He's trying to work to recoup that
money but I want to know if he can write off 3K in
taxes? He does Uber eats and he can use mileage to
deduct from his taxes. So let's say he only has to pay
4k in taxes but he lost 3K. Does he only have
to pay 1k? Also what if he drove enough to deduct the
whole 4k? Does he get a refund? I know you guys aren't
tax experts but I'm asking people who did the deduction before and how it went",How does the 3K capital loss tax deduction work?,2022-08-06
wallstreetbets,,How's everyone saying SI is over 100%$BBBY? only 46%! little help out here,2022-08-06
wallstreetbets,,who else made money off Telsa this week?,2022-08-06
wallstreetbets,[removed],NUWE interessing for next week....market cap 7 milions ..earning 9 August for me revenue going up 2.2 milions book value 2.06 last price 0.68,2022-08-06
wallstreetbets,[removed],ABCD Corp such a great company. and no BS unless your a gay fag like myself,2022-08-06
wallstreetbets,,send help bros,2022-08-06
wallstreetbets,,Person made a gambling bet about a ticker,2022-08-06
wallstreetbets,[removed],Invest in BBBY before it’s too late!!,2022-08-06
wallstreetbets,"Hello everyone, i am trying to reach out to the people who knew M E G  L stock would do very well,  or the people who made a gambling bet and said that it would do very well.  Like all online discussion, it is very fucking hard to post shit because auto mod mother fuckers like to delete anything and everything you could possibly post,  i am just trying to talk about this one stock and see why people had a hunch that it could rocket, hope this fucking rocket is long enough for you........","There is a stock called M E G L, and some people predicted it would show huge gains earlier this week",2022-08-06
wallstreetbets,,Another PnD from ol' Musky coming in...he didn't get enough money from last scam to service debts?,2022-08-06
wallstreetbets,[removed],"MEGL initial offering went very well, does anyone have any insight on this stock?",2022-08-06
wallstreetbets,"Anyone want to jump in about why they predicted MEGL would also rocket?    

&amp;#x200B;

Chinese-based stock","Giving up with posting the conversation, but there are users who predicted MEGL earlier this week.",2022-08-06
wallstreetbets,,Never trust men in suits.,2022-08-06
wallstreetbets,,"Attempt 6, not sure why this can't be talked about",2022-08-06
wallstreetbets,,First report since merger…exit before earnings next time maybe,2022-08-06
wallstreetbets,,"Try 5, somebody made some gains with this idea shown below",2022-08-06
wallstreetbets,"Trying to avoid getting railed by the market whilst learning how to trade, how are y’all wizards flipping a few thousands to 6 figures in a couple weeks?

Books, YouTube whatever…need the step by step.",Teach Me Ol Wise Ones,2022-08-06
wallstreetbets,,"Try 4, there is a discussion here that shows some huge gains for one of these today",2022-08-06
wallstreetbets,At this “murder mystery party”. Mad corny. Been shit posting all night. But this one girl been looking at me all night and she’s cute. But she was the murderer. I’m drunk and have gassy delta 8 at the crib. What’s the play??,Thoughts,2022-08-06
wallstreetbets,,"Try 3, MEGL called out before the hype ..... Chine-se based stock",2022-08-06
wallstreetbets,,"Try 2, this mother fucker called out MEGL before they went HAm",2022-08-06
wallstreetbets,,Yo so this user called the next Chinese based stock IPO stupid gains (MEGL),2022-08-06
wallstreetbets,,Thanks to BBBY I am no longer PDT cucked. Rolling to higher strike calls Monday- 🚀,2022-08-06
wallstreetbets,"if gamestop's share price is going to the moon, you should be looking to scrounge up as many shares as possible, right? any interest should be negligible, as what's a few % to $1,000,000,000? I'm willing to loan up to $500k at 5% interest per day, if you are able to put up collateral.",does anyone want a loan to buy more gme shares?,2022-08-06
wallstreetbets,"I been watching WSB for a while, I did notice that there are quite a few try to beat the market by investing some heavy risky derivatives, i.e., naked call/put option. If you are a professional trader, ignore what I say. But if you are just into the market and try to gain some money, here is a right way to do it.

**For start, you should avoid any short-term action**, which by IRS, any position hold for less than a year. Not because some BS around, simply for tax advantages. Any assets hold less than a year is subject to ordinary income tax rate which in general, MUCH higher than long term capital gain. You don't want IRS to take a cut of profit for no reason, right?

**Secondly, do not timing the market.** If there is one thing I learn from the past 5 years of trading, nobody knows how market could do tomorrow, or the day after tomorrow, or next week, next month, or next year. This has been proven over and over. But people just don't believe it. They created graphs, lines, chats, all kind of ""Voodoo"" try to predict a short-term market. But so far, we haven't heard anyone who become super rich by timing or predict it.

But people still doing it anyway, just like those historical numbers on roulette, you know mathematically previous results has absolutely nothing to do with current results, but we just try to connect the dots, and still enjoy it even though it is a BS.

I do it as well, it is human nature. But if you want to make money, you have against it. In 2013, Nobel Laureate in Economic Sciences was awarded jointly to Eugene F. Fama, Lars Peter Hansen and Robert J. Shiller for proven that short term market movement is not predictible in short, it is ramdon movement (actually it is Geometric Brownian motion, but we don't need that much details). Which kind of officially announced everything is BS in financial market. However, for long time prediction, it could be very accurate. That is why when you are seeking advise from any kind of finical advisor (As long as they are licensed), they will recommend you invest at least for 3 years.

Here is a list of long holing stocks I have since 2017, you can see since time elapse, the only factor to determine a stock price is it cash flow. Which is how the price of stock is valuated. The price of stock represents company future cash flow discounted to current dollar value.

https://preview.redd.it/s7a1wnc3l0g91.png?width=2702&amp;format=png&amp;auto=webp&amp;s=e87a513029e1c7f8ea2ff7d9880e2a52b80117e1

So, our job is simple. When market is in panic mode, assets won’t price correctly. Companies with solid fundamentals, will trade less than what it worth. We buy in and hold until the fair value is presented. Sell only if you need money for vacation, buy a car, a house or support child for school, or the fundamental of a company has changed.

In finance, people use Discount Cash Flow  model to calculate a company future cash flow discounted to current value. The calculation is complex, and there are lots of parameter input is by human guessing. That is why you need to invest in multiple companies to increase you chance of success. Which leads to my third point: unless you have non-public information from a reliable source, such as our house of speaker Nancy Pelosi, or company’s C level executives, which then you are subject violation of insider trading; **you should never put more than 10% of your entire portfolio into one single assets.**

Yes, people paste lots of attractive screen shots by gambling solely on GME, AMC, BBYC, etc. But the thing for gambling, is that the overall expectation is not in your favor. There is always lucky winner for each draw, but most likely will not be you. Since you are not kissed by God, investing in multiple assets is your only way to make money in a constant pace, which means portfolio diversification.

But to manage a portfolio is expansive and time consuming. It feels like working on a 2nd job. You basically acting as a fund manager, reading research reports, following news, trace macro economy and all kind of data, even with all that, sometimes still got fucked by the market.

Lucky, for every demand there is a service. We can investing in mutual fund or simply ETFs to achieve similar results by paying a small portion of fees. Which is I recommended most people to do. My self for example, have 60% of positions on varieties of mutual funds or ETFs. I know my limitation, I am good at value those high-tech firm, since this is the area that I work for almost 10 years, I know the future of the industry, better than those analysts. So do this part by myself. The area that I am not so familiar with, such as traditional industries, energy, and etc, I buy funds that will covers it. Together, these assets create a Fund of Funds, which basically covers all good companies across the globe. This strategy went well so far. Average annual return for the past 5 years is around 18%.

This way has been proven that will work. by throwing everything into a Monte Carlo (commonly used in assets return prejection for a LONG period of time). My portfolio return is granteed. Althought leaglly fund manger can't promiss you anything, but for sure, long lasting funds will genertate lots of money in a long period of time.

However, no body like to be rich slowly.  You must give your money time to grow. It will pay you back in time.","Besides Those Mad Dog Type Option Trading, How to Build Up Your Wealth?",2022-08-06
wallstreetbets,"So hear me out. BBBY. I'm buying a large position next week because this is trending on wall street bets means that the buy orders are going to cause this stock to go up right? So. This is my strategy, buy it because everyone is talking about it on wall street bets. See you fools when I'm a millionaire.",Why I'm buying a large position in BBBY next week,2022-08-06
wallstreetbets,,This will never end,2022-08-06
wallstreetbets,,Hmmmm… 🤔,2022-08-06
wallstreetbets,,$SOFI Baader-Meinhof my money!,2022-08-06
wallstreetbets,,"did a bunch of retards buy $BBBY today? wtf guys, you make me so proud",2022-08-06
wallstreetbets,"Does anyone have an opinion on this company? Invested.liek 20$ in the spring and lost most of my money. I guess that's a pitfall of investing, I like the idea though but mainly because I love tripping lol",CYBN,2022-08-06
wallstreetbets,,Hey guys I heard we're doing a thing! $BBBY Yolo,2022-08-06
wallstreetbets,"I think I found an infinite money glitch, but obviously that can't be, right?

I'm only a 0.0X holder right now (GME of course), but when we get to the phone numbers and I'm able to sell my share for a ton of money, what's stopping me from just buying a bigger percentage of gamestop and then selling that for even more money, etc. etc. Like if I sell my 0.0x share for $100,000,00, what's stopping me from buying like 500,000 shares with that money and then turning around and selling that for 500,000,000,000,000,00?

What am I missing?",Can someone please tell me what I'm missing?,2022-08-06
wallstreetbets,"I been watching WSB for a while, I did notice that there are quite a few try to beat the market by investing some heavy risky derivatives, i.e., naked call/put option. If you are a professional trader, ignore what I say. But if you are just into the market and try to gain some money, here is a right way to do it. 

**For start, you should avoid any short-term action**, which by IRS, any position hold for less than a year. Not because some BS around, simply for tax advantages. Any assets hold less than a year is subject to ordinary income tax rate which in general, MUCH higher than long term capital gain. You don't want IRS to take a cut of profit for no reason, right?

**Secondly, do not timing the market.** If there is one thing I learn from the past 5 years of trading, nobody knows how market could do tomorrow, or the day after tomorrow, or next week, next month, or next year. This has been proven over and over. But people just don't believe it. They created graphs, lines, chats, all kind of ""Voodoo"" try to predict a short-term market. But so far, we haven't heard anyone who become super rich by timing or predict it. 

But people still doing it anyway, just like those historical numbers on roulette, you know mathematically previous results has absolutely nothing to do with current results, but we just try to connect the dots, and still enjoy it even though it is a BS. 

I do it as well, it is human nature. But if you want to make money, you have against it. In 2013, Nobel Laureate in Economic Sciences was awarded jointly to Eugene F. Fama, Lars Peter Hansen and Robert J. Shiller for proven that short term market movement is not predictible in short, it is ramdon movement (actually it is Geometric Brownian motion, but we don't need that much details). Which kind of officially announced everything is BS in financial market. However, for long time prediction, it could be very accurate. That is why when you are seeking advise from any kind of finical advisor (As long as they are licensed), they will recommend you invest at least for 3 years. 

Here is a list of long holing stocks I have since 2017, you can see since time elapse, the only factor to determine a stock price is it cash flow. Which is how the price of stock is valuated. The price of stock represents company future cash flow discounted to current dollar value. 

[Some Stocks I Hold with Gain Over 100&amp;#37;](https://preview.redd.it/c6sspheue0g91.png?width=2702&amp;format=png&amp;auto=webp&amp;s=e613accb3bda90145e9281c43a94b4962bf59f24)

So, our job is simple. When market is in panic mode, assets won’t price correctly. Companies with solid fundamentals, will trade less than what it worth. We buy in and hold until the fair value is presented. Sell only if you need money for vacation, buy a car, a house or support child for school, or the fundamental of a company has changed. 

In finance, people use Discount Cash Flow (DCF) model to calculate a company future cash flow discounted to current value. The calculation is complex, and there are lots of parameter input is by human guessing. That is why you need to invest in multiple companies to increase you chance of success. Which leads to my third point: unless you have non-public information from a reliable source, such as our house of speaker Nancy Pelosi, or company’s C level executives, which then you are subject violation of insider trading; **you should never put more than 10% of your entire portfolio into one single assets.** 

Yes, people paste lots of attractive screen shots by gambling solely on GME, AMC, BBYC, etc. But the thing for gambling, is that the overall expectation is not in your favor. There is always lucky winner for each draw, but most likely will not be you. Since you are not kissed by God, investing in multiple assets is your only way to make money in a constant pace, which means portfolio diversification. 

But to manage a portfolio is expansive and time consuming. It feels like working on a 2nd job. You basically acting as a fund manager, reading research reports, following news, trace macro economy and all kind of data, even with all that, sometimes still got fucked by the market. 

Lucky, for every demand there is a service. We can investing in mutual fund or simply ETFs to achieve similar results by paying a small portion of fees. Which is I recommended most people to do. My self for example, have 60% of positions on varieties of mutual funds or ETFs. I know my limitation, I am good at value those high-tech firm, since this is the area that I work for almost 10 years, I know the future of the industry, better than those analysts. So do this part by myself. The area that I am not so familiar with, such as traditional industries, energy, and etc, I buy funds that will covers it. Together, these assets create a FOF (Fund of Funds), which basically covers all good companies across the globe. This strategy went well so far. Average annual return for the past 5 years is around 18%. 

This way has been proven that will work. by throwing everything into a Monte Carlo (commonly used in assets return prejection for a LONG period of time). My portfolio return is granteed. Althought leaglly fund manger can't promiss you anything, but for sure, long lasting funds will genertate lots of money in a long period of time. 

However, no body like to be rich slowly.  You must give your money time to grow. It will pay you back in time.","Besides Those Mad Dog Type Option Trading, How to Build Up Your Wealth?",2022-08-06
wallstreetbets,"Where the hell where all you apes when XBI was making a bull flag for the past two weeks??  Y’all were too busy climbing up GME’s ass to see the trade of the lifetime.  Back to the original topic, XBI is just getting started.  The sellers have dried up.  It looks like it is making a run to $130.  GLTA",XBI breakout,2022-08-06
wallstreetbets,[removed],Yieldnotes - The next generation of passive income (5-15% per month),2022-08-06
wallstreetbets,,$BBBY 6.2k shares at 6.41 LFG 🚀🚀🚀🚀🚀🚀🚀🚀🚀🚀🚀🚀,2022-08-06
wallstreetbets,,Another worthless Hong Kong company with only 9 employees,2022-08-06
wallstreetbets,"Input - my father, who passed away 11 years ago, just visited me in my sleep and specifically told me to prepare for a SECOND WAR. 

This is a first time for me where a dream was so specific. 

This may or may not mean China. But I did anticipate a much harsher response this week over the Pelosi visit. And I did see the post somewhere here the the number 8 has a lot of meaning for the Chinese. Monday is 08.08

It could be something involving Russia and Europe, or another country. 

If it’s around China - what are we shorting on Monday?",If China vs Taiwan happens on Monday - what are the plays?,2022-08-06
wallstreetbets,,I enjoy the gain porn but love to see the comeback porn,2022-08-06
wallstreetbets,Anxious Demon takeover all my followers push it go I run this sub I am hod I’m the smartest beep booo short qqq long ttwo,Demon Gang,2022-08-06
wallstreetbets,"*jerking off*
mmm yea mommy tell me how pathetic i am
mmmmmmmm call me a retard and slap me

no but for real, AMC to the moon! i got barely a fuckin clue what i’m talking about but the amc ape will win. 
isn’t this what you wanted",🥹🥹🥹🥹,2022-08-06
wallstreetbets,"If I could, I would only do my shopping at gamestop to support my company and my employees.

Unfortunately, gamestop doesn't carry everything I need in a given day. Do you think we can all band together and get them to start selling groceries/clothes/cars/etc.?

If they cannot afford the additional inventory, maybe we can do a gofundme or patreon to help support our CEO (Ryan) with this venture.

Keep in mind, to go after Amazon gamestop will need to come from every angle. The sooner the beter imo",Can we lobby gamestop to carry certain products?,2022-08-06
wallstreetbets,The people of WSB have spoken! AnxiousDemon1125 is now universally recognized as the ceo and spokesperson of WSB! Congrats!,AnxiousDemon CEO,2022-08-06
wallstreetbets,[removed],BYND…: do it,2022-08-06
wallstreetbets,[removed],Gains,2022-08-06
wallstreetbets,"I saw Ken Griffen at a grocery store in Miami yesterday. I told him how horrible  it was to hurt Gamestop, but I didn’t want to be a douche and bother him and maybe get arrested or anything.
He said, “Oh, like you’re doing now?”
I was taken aback, and all I could say was “Huh?” but he kept cutting me off and going “huh? huh? huh?” and closing his hand shut in front of my face. I walked away and continued with my shopping, and I heard him chuckle as I walked off. When I came to pay for my stuff up front I saw him trying to walk out the doors with like fifteen gallons of mayo in his hands without paying.
The girl at the counter was very nice about it and professional, and was like “Sir, you need to pay for those first.” At first he kept pretending to be tired and not hear her, but eventually turned back around and brought them to the counter.
When she took one of the jars and started scanning it multiple times, he stopped her and told her to scan them each individually “to prevent any electrical infetterence,” and then turned around and winked at me. I don’t even think that’s a word. After she scanned each jar and put them in a bag and started to say the price, he kept interrupting her by yawning really loudly.",I saw Ken Griffen at the grocery store yesterday,2022-08-06
wallstreetbets,,Son of a bi-,2022-08-06
wallstreetbets,,Some of you guys (me) won’t read this and it shows,2022-08-06
wallstreetbets,"Already this is dosed to thousands of patients now. This treatment immediately works. Read the patient story: 
https://turnto10.com/amp/news/local/monkeypox-vaccine-clinic-rhode-island-massachusetts-illness-isolation-rash-lesions-medical-global-health-emergency-healthcare-doctor-fever-chills-cdc-tpoxx-medication",$SIGA Reddit army send this to $200 on Monday. read this important story,2022-08-06
wallstreetbets,,Be offended,2022-08-06
wallstreetbets,[removed],CORGICOIN,2022-08-06
wallstreetbets,"I am graduating from Harvard Business School next year and I thought it would be great to get our beloved CEO (Ryan :) ) to speak at our graduation. As you know, lots of graduates from Harvard go on to work on wall street and destroy companies at BCG so I was thinking Ryan could help convince them to join our side instead and help us reach the moon.

how would I contact him? I sent gamestop's investor relations an email, but they never replied.",How can I get our beloved CEO (Ryan Cohen) to speak at my graduation?,2022-08-06
