subreddit,selftext,title,created_date
wallstreetbets,,Following WSB Plays over the course of 4 months. This sub sucks,2022-08-05
wallstreetbets,"Hey, I did a little research on Paramount today and would like to share my findings with you. I think the market is more than wrong on valuation (Paramount is trading at 4 P/E and 0.72 P/B) and also the short float of 9.08% is not justified. Here's why.

Many investors are making it too easy for themselves. They see a seemingly ""dying"" industry and punish companies in it. Moreover, they unqualifiedly say that a company would not manage to adapt and become contemporary. Granted, the latter point is often true, but not always, and research is needed to see if this caveat should be trusted.

**What are Paramount's good qualities that make this rating overstated?**

Paramount is an established company with a great track record. I don't even have to tell that to people who have never looked at the stock before. It was founded in 1986 and has been a top player in the film and TV industry for years.

In addition, Paramount has stable financials. With $28B Revenue in 2021, it has made 12% plus from the previous year. Moreover, while it has deteriorated, it is still much more profitable than other companies in the industry:

&amp;#x200B;

[Profitability Rank on Gurufocus.com. Paramount compared with Industry and History](https://preview.redd.it/d089mb0xnrf91.png?width=702&amp;format=png&amp;auto=webp&amp;s=dcd179b2a7391d6f8d3747d0bf491d7df864378d)

I don't know what you guys think about Gurufocus, but for an overview I think it's quite helpful.

&amp;#x200B;

https://preview.redd.it/1pzxhq60orf91.png?width=470&amp;format=png&amp;auto=webp&amp;s=3e3c7a72d057f1f983c78edbac04470388ea448d

https://preview.redd.it/cje16wn1orf91.png?width=652&amp;format=png&amp;auto=webp&amp;s=8f054b378e268baa6ead0352308534714f4d7316

**Paramount's goal: transformation to streaming business**

You may have heard of Paramount+. Paramount+ is Paramount's streaming service. Paramount has realized, as we all have, that the future is not in linear television, but in streaming. Paramount wants to become a competitor of Netflix and co. and offer their content on the Internet and in video-on-demand form.

[Presentation explaining the transformation plans in more detail](https://preview.redd.it/tug21cp3orf91.png?width=1962&amp;format=png&amp;auto=webp&amp;s=5868e8bfa1fced3320cc9dfe1b18a811bce0672a)

&amp;#x200B;

https://preview.redd.it/oo3kegwborf91.png?width=640&amp;format=png&amp;auto=webp&amp;s=9ad1dfc21102f8ad61e2449c5e2842ea0380f19c

They are available globally and already have a wide range of offerings with series from top franchises. They also create original content like Amazon Prime and Netflix. [https://en.wikipedia.org/wiki/List\_of\_Paramount%2B\_original\_programming](https://en.wikipedia.org/wiki/List_of_Paramount%2B_original_programming)

Paramount+ has already managed to achieve 140% growth in subscribers and revenue.

**Why it is likely that this transformation will work out**

Many investors seem to assume that it won't work. What they're overlooking is this:

Paramount has a high moat. Paramount includes CBS, Showtime, Paramount Studious, Nickelodeon and other networks. Their sports network is the broadcaster for the NFL, NCAA, PGA, and the UEFA Champions League. Despite Paramount's transformation into a streaming service, the traditional part of the business is still doing well and unlike Netflix, Paramount is able to produce and profitably share its content across all its platforms without depending on streaming. As the quote goes: Content is king

https://preview.redd.it/03mwqjoeorf91.png?width=1962&amp;format=png&amp;auto=webp&amp;s=d81f540c45afcbcaa25febf507811efb7f28bec0

Paramount's strategy is to maximize the quantity and quality of its content, thereby increasing its long-term value to investors. The whole thing is described in detail in this lecture. Really really recommendable: [https://ir.paramount.com/streamingevent](https://ir.paramount.com/streamingevent)

The company knows what it's doing. To me, none of this looks at all like a desperate attempt by an outdated company to somehow stay alive. I think the strategy will pay off over the next few years, and with continued adoption of their streaming, potential exclusives as catalysts, and stabilization over the next few years, it will pay to take the risk now. Growth costs, no doubt without, but it's a path that needs to be taken and one that I see as really promising.

Just my personal opinion. Watchlist advise, not a buy recommendation. I will buy shares of Paramount tomorrow.",Long Idea: Paramount - Why the market is wrong about the media giant,2022-08-05
wallstreetbets,,Calling it: Every damn election cycle,2022-08-05
wallstreetbets,Better get your tickets now.🚀🚀🚀🚀,Canoo may have a deal with BMW!!!,2022-08-05
wallstreetbets,[removed],Did someone shorted BYND? I did miss it,2022-08-05
wallstreetbets,,Adam Aaron answers the call. Share count under AMC Preferred Equity or APE,2022-08-05
wallstreetbets,,"Which gender are you? WBD announces HBO Max will go up in Discovery+, bad decision",2022-08-05
wallstreetbets,[removed],shorting HKD,2022-08-05
wallstreetbets,"Title explains it all.


Since bot likes longer posts:

Filler Filler Filler Filler Filler Filler Filler Filler Filler Filler Filler Filler Filler Filler Filler Filler Filler Filler Filler Filler Filler Filler Filler Filler Filler Filler Filler Filler Filler Filler Filler Filler Filler Filler Filler Filler Filler Filler Filler Filler Filler Filler Filler Filler Filler Filler Filler Filler Filler Filler Filler Filler Filler Filler Filler Filler Filler Filler Filler Filler Filler Filler Filler Filler Filler Filler Filler Filler Filler Filler Filler Filler Filler Filler Filler Filler Filler Filler Filler Filler Filler Filler Filler Filler 

Filler Filler Filler Filler Filler Filler Filler Filler Filler Filler Filler Filler Filler Filler Filler Filler Filler Filler Filler Filler Filler Filler Filler Filler Filler Filler Filler Filler Filler Filler Filler Filler Filler Filler Filler Filler Filler Filler Filler Filler Filler Filler Filler Filler Filler Filler Filler Filler Filler Filler Filler Filler Filler Filler Filler Filler Filler Filler Filler Filler Filler Filler Filler Filler Filler Filler Filler Filler Filler Filler Filler Filler Filler Filler Filler Filler Filler","If oil is free falling due to economic slowdown ahead, why isn’t the rest of market foreseeing economic slowdown?",2022-08-05
wallstreetbets,,We don’t talk about Lordstown…,2022-08-05
wallstreetbets,"Faze good stock. Long; green line: why nobody talk? I like big number, and video game. Why not buy faze, is good?",Why nobody invest faze?,2022-08-05
wallstreetbets,,Andrew Bailey as a bear,2022-08-05
wallstreetbets,"Guys I really like this stock, But im not an analyst so I’d love to see what traders think in the comments. I didn’t have any money when i bought is at $16.72 so i only have 5 shares.
It’s sitting at just over 20$ today and the sentiment is very bullish. Consensus is “ Strong Buy”. New Sentiment last 7 days is “ very bullish “ Blogger Sentiment 100% Bullish. Its got good momentum 52.01% with a price target of $33.6. Ive been watching this stock hang around 15-16$ for a while now with that 30$ price target and I think its finally here. Please let me know what your thoughts are. ( ps: my first post )",$KDNY Chinook Therapeutics,2022-08-05
wallstreetbets,,wish I had more than 9 call orders,2022-08-05
wallstreetbets,Think a lot of focus in this community should be shifted to $FUBO. Shorts could get killed with this stock. WSB needs to capitalize..,$FUBO opportunity ?,2022-08-05
wallstreetbets,,Jpow and Yellen raging against inflation,2022-08-05
wallstreetbets,,Is there hope 😢,2022-08-05
wallstreetbets,[removed],Yooo guys let’s see if we can make MEGL pop tmmrw boys🚀🚀🚀🚀,2022-08-05
wallstreetbets,"Carvana (CVNA) has a 46.56% short interest as a percentage of float. Earnings just announced were surprisingly good, would this be a good short squeeze candidate? My thinking is that some shorts are going to be getting hammered with a nearly 50% float of 'fake' stock holders.

[Carvana](https://finance.yahoo.com/quote/CVNA/key-statistics/)",Is Carvana a good short squeeze?,2022-08-05
wallstreetbets,[removed],Fubo Squeeze?,2022-08-05
wallstreetbets,"Hey, I did a little research on Paramount today and would like to share my findings with you. I think the market is more than wrong on valuation (Paramount is trading at 4 P/E and 0.72 P/B) and also the short float of 9.08% is not justified. Here's why.

Many investors are making it too easy for themselves. They see a seemingly ""dying"" industry and punish companies in it. Moreover, they unqualifiedly say that a company would not manage to adapt and become contemporary. Granted, the latter point is often true, but not always, and research is needed to see if this caveat should be trusted.

**What are Paramount's good qualities that make this rating overstated?**

Paramount is an established company with a great track record. I don't even have to tell that to people who have never looked at the stock before. It was founded in 1986 and has been a top player in the film and TV industry for years.

In addition, Paramount has stable financials. With $28B Revenue in 2021, it has made 12% plus from the previous year. Moreover, while it has deteriorated, it is still much more profitable than other companies in the industry:

[Profitability Rank on Gurufocus.com. Paramount compared with Industry and History](https://preview.redd.it/hryaf91ldrf91.png?width=702&amp;format=png&amp;auto=webp&amp;s=b26b1f927ea602c27165bf53789af5471b8a226f)

&amp;#x200B;

[GF Score - Gurufocus.com](https://preview.redd.it/y26qd36cirf91.png?width=470&amp;format=png&amp;auto=webp&amp;s=83a29cafcc2567df9d771df3d2e7a3698b19889d)

I don't know what you guys think about Gurufocus, but for an overview I think it's quite helpful.

&amp;#x200B;

[Valuation Box. Gurufocus.com](https://preview.redd.it/wlwg43gnirf91.png?width=652&amp;format=png&amp;auto=webp&amp;s=546ea85ff60ca50a8eafad48a0cfe62b1746af94)

**Paramount's goal: transformation to streaming business**

You may have heard of Paramount+. Paramount+ is Paramount's streaming service. Paramount has realized, as we all have, that the future is not in linear television, but in streaming. Paramount wants to become a competitor of Netflix and co. and offer their content on the Internet and in video-on-demand form.

*Processing img sni5f1b4erf91...*

&amp;#x200B;

https://preview.redd.it/ipazizqzfrf91.png?width=640&amp;format=png&amp;auto=webp&amp;s=d1c477486d8be6daecb5386f9b06b76f50ea45e5

They are available globally and already have a wide range of offerings with series from top franchises. They also create original content like Amazon Prime and Netflix. [https://en.wikipedia.org/wiki/List\_of\_Paramount%2B\_original\_programming](https://en.wikipedia.org/wiki/List_of_Paramount%2B_original_programming)

Paramount+ has already managed to achieve 140% growth in subscribers and revenue.

**Why it is likely that this transformation will work out**

Many investors seem to assume that it won't work. What they're overlooking is this: 

Paramount has a high moat. Paramount includes CBS, Showtime, Paramount Studious, Nickelodeon and other networks. Their sports network is the broadcaster for the NFL, NCAA, PGA, and the UEFA Champions League. Despite Paramount's transformation into a streaming service, the traditional part of the business is still doing well and unlike Netflix, Paramount is able to produce and profitably share its content across all its platforms without depending on streaming. As the quote goes: Content is king

https://preview.redd.it/u6a5xgnnfrf91.png?width=1962&amp;format=png&amp;auto=webp&amp;s=f452b0f1379fa243876fc5d6d1edbe2cf878d4ec

Paramount's strategy is to maximize the quantity and quality of its content, thereby increasing its long-term value to investors. The whole thing is described in detail in this lecture. Really really recommendable: [https://ir.paramount.com/streamingevent](https://ir.paramount.com/streamingevent)

The company knows what it's doing. To me, none of this looks at all like a desperate attempt by an outdated company to somehow stay alive. I think the strategy will pay off over the next few years, and with continued adoption of their streaming, potential exclusives as catalysts, and stabilization over the next few years, it will pay to take the risk now. Growth costs, no doubt without, but it's a path that needs to be taken and one that I see as really promising.

Just my personal opinion. Watchlist advise, not a buy recommendation. I will buy shares of Paramount tomorrow.",Long Idea: $PARA - Why the market is wrong about the media giant,2022-08-05
wallstreetbets,,Someone needs to make the inverse Cathie fund. So I can diversify from only the inverse Cramer fund.,2022-08-05
wallstreetbets,,"i know im bad at math, but damn i miscalculated",2022-08-05
wallstreetbets,,Taiwan was probably a successful visit?,2022-08-05
wallstreetbets,Blew up two accounts. Webull account only existed because I got banned from day trading on Robinhood. You see how well that went. I’ll see you degens in 2023,Some Amateur Loss Porn,2022-08-05
wallstreetbets,,Gain 🍿,2022-08-05
wallstreetbets,,Yolo: Blew up account took out a 20k personal loan to make up the money I lost was sweating bullets all day but won by $3. I belong here,2022-08-05
wallstreetbets,,18 years old 130k profit in a day,2022-08-05
wallstreetbets,[removed],how are earnings calls still literally analog telephone calls with terrible audio quality instead of any of the VoIP solutions that don’t have lossy audio,2022-08-05
wallstreetbets,,The Taiwan visit was a great success!,2022-08-05
wallstreetbets,[removed],How you got into stock trading,2022-08-05
wallstreetbets,,☠️☠️☠️🔫🔫🔫,2022-08-05
wallstreetbets,"What makes the GETY gamma squeeze situation unique

500K float is one thing. A lot of stocks have floats like that. The insane short interest  - 2 million or whatever - even that is not unheard of.

What makes this truly unique is the call option contracts coupled with the small float. Retail can spend $3,000 on 100 shares or $3,000 on six $30 call options that cause the option writing funds to buy 600 shares as soon as the contracts go ITM.

There are over 6,000 August call option contracts that are ITM according to Yahoo from strikes ranging from $2.50-$30. That alone is over 600K shares locked in hedge. That doesn't consider the volume on each strike today, the fact that the $35 strikes and likely $40 strikes are going ITM tomorrow and the open interest on the September to February options.

Gamma squeeze indeed. This is GME on steroids.",What makes GETY gamma squeeze unique?,2022-08-05
wallstreetbets,"lithium batteries, 18V, 2-speed, 13mm keyless chuck, reversible impact Suitable for drilling wood, metal and bricks with holes up to 36mm, driving and unscrewing wood screws, self-drilling screws and self-tapping screws Lithium battery which guarantees longer charging time and shorter recharging time, no memory effect - Quick to use. Keyless chuck for quick and easy change of accessories - 13mm chuck allows the use of all tip sizes - Non-slip handle for a more secure grip

more=&gt;  https://heattreak.com/?a=5322&amp;oc=15223&amp;c=42272&amp;m=28&amp;s1=",makita,2022-08-05
wallstreetbets,[removed],Are we all buying AMTD or is it to late for that?,2022-08-05
wallstreetbets,,buying more,2022-08-05
wallstreetbets,,Costco shit,2022-08-05
wallstreetbets,[removed],AMTD still?,2022-08-05
wallstreetbets,,Massive!!!!!!,2022-08-05
wallstreetbets,[removed],In or Not In On Poseida Therapuetics ?,2022-08-05
wallstreetbets,,People who were able to sell HKD be like,2022-08-05
wallstreetbets,,Be careful out there fam.,2022-08-05
