subreddit,selftext,title,created_date
wallstreetbets,[removed],Let’s pick a stock and take it to the moon … where should we start?,2022-08-07
wallstreetbets,[removed],If you can pick one stock (large cap) to invest in over the next 2 years. What would it be?,2022-08-07
wallstreetbets,,I fixed u/CollegeThrowaway___'s meme. It's more accurate now.,2022-08-07
wallstreetbets,,Anyone up for a four leaf ($CLOV) ER play? 🍀,2022-08-07
wallstreetbets,"Hi WSB guru,

I tried asking this question in AMC sub but this is not a well received/popular topic so I thought I might get more insight from here!

From my understanding APE is a preferred equity unit for all AMC holders with par value of $0.01. It is given to current holders so it is not dilutional. 

However its value cannot be determined currently, some suggest it will start trading around 50% of AMC price more or less, but if AMC holders vote against allowing APE able to convert into AMC it will essentially be worthless? 

I hold AMC LEAP and I am worried about what would happen. From the surface this look like a forward stock split so my option price will drop 50% and I will get double my contract?

Any help or suggestions would be greatly appreciated!",Anyone else holding AMC LEAP calls and what do you think will happen?,2022-08-07
wallstreetbets,,Anyone up for a four leaf ($CLOV) ER play? 🍀,2022-08-07
wallstreetbets,"I want to start learning about options any good places to start. Also when you set up an option and it says max cost, how bad can It go if you fuck up, and am wrong or can I basically fuck around with small bets until I figure it out. I know you can lose a lot in options or gain a lot so I want to at least be educated",im a noob,2022-08-07
wallstreetbets,"Alright, let's get into this. We've already heard this name Revlon pop up a bunch of times, but next week can truly get nutty here. Especially after seeing the poppy action right at the end of the day today, I'm convinced we get a squeeze here. Let's take a look at the reasons why:

After many high short interest names moving this week, my best stock pick to take over the weekend in anticipation of a Short squeeze is [$](https://substack.com/discover/stocks/REV)REV. Now, why $REV? Well let’s take a look at why this stock can go.

This is the market’s most shorted stock at a whopping 61% of the float being sold short here on S3 Data which costs $9000 a year and is on the Bloomberg terminal, so it's generally considered one of the best in the industry. This is confirmed by S3 Shortsight Data here:

&amp;#x200B;

https://preview.redd.it/vbekrpph98g91.png?width=1054&amp;format=png&amp;auto=webp&amp;s=376c6383dcc48f88715e9b2d8fc99829e3f06fce

With it being the most shorted stock, it definitely has eyes on it at all times. Not only is it confirmed by S3, but also by Ortex Data, so we can guarantee that this data is as accurate as it can get since we have multiple sources confirming here.

&amp;#x200B;

https://preview.redd.it/m4fzktmi98g91.png?width=570&amp;format=png&amp;auto=webp&amp;s=8e13adf2a9e6bfdda32ab0e9a313b1b23032b3b8

On the Ortex data we can see 71% of the float is being sold short with a 380% average cost to borrow. These are pretty large numbers.

But that’s not it…

&amp;#x200B;

https://preview.redd.it/3umdf3ij98g91.png?width=456&amp;format=png&amp;auto=webp&amp;s=6549f463c5a526b7f61955221a696ef16be97282

[$](https://substack.com/discover/stocks/REV)REV was just granted a $1.4 billion loan, but the market cap is only 433 million, so this is really good news for the company.

The short squeeze thesis gets even better from here though. Fintel data has REV as number 2 on their squeeze list, up 20 spots today. It was given a squeeze score of 99.12/100, extremely high.

&amp;#x200B;

https://preview.redd.it/7vvytxqk98g91.png?width=1456&amp;format=png&amp;auto=webp&amp;s=ccbf3270bbaf5046ef721598026458023c65d4d4

The options flow on REV has been insane the last two days as well. Huge institutional orders adding up to the millions have been bought. Some buyers even went as far as buying the 35C, when the stock is currently at 8, showing an expected 350% move in stock price.

&amp;#x200B;

https://preview.redd.it/pkydm0nl98g91.png?width=1456&amp;format=png&amp;auto=webp&amp;s=72232a38ce30481868f1141373271354eb282003

All this call option activity has led REV not only to become a short squeeze target here, but also a gamma squeeze target. With the #1 spot on the Fintel gamma squeeze list, it has a score of 99.57/100 at the highest spot. The Net call OI is 50% of the float. If this decides to send this can not only squeeze out shorts, but also cause a gamma squeeze here.

&amp;#x200B;

https://preview.redd.it/2tuk6kcq98g91.png?width=2526&amp;format=png&amp;auto=webp&amp;s=283fedb969090ffe859dd2db6cffc046dfb7379c

The chart has a beautiful bull flag breakout here as well. One of the best in the entire market.

&amp;#x200B;

https://preview.redd.it/k0p4rgpm98g91.png?width=1878&amp;format=png&amp;auto=webp&amp;s=25c6e079766c7df04f7415a4b4d5ce4bd6647c13

To recap $REV:

1. 61% short interest on S3 Data
2. 70% short interest on Ortex Data, confirming a high % of the float is short
3. 400% cost to borrow as confirmed by Ortez
4. Granted a $1.4 billion loan on a stock with a $400 million market cap
5. Number 2 on the Fintel short squeeze list with a score of 99.12/10
6. Huge call option activity into the millions of dollars with not a single put being bought in unusual quantities.
7. Number 1 on the Fintel gamma squeeze list with a score of 99.57/100
8. Earnings next week (shorts like to cover before earnings to reduce risk)

In my opinion, there is no other better play for Monday morning other than $REV here. The theme is right and with it being the most shorted stock on the market this can go crazy.

I like posting DD like this on [aditdayal.substack.com](https://aditdayal.substack.com/) as well so if you enjoyed this feel free to sign up there as well.

Not financial advice as usual, you can follow me on [www.twitter.com/tradelikehulk](https://www.twitter.com/tradelikehulk)

Thanks for reading, not financial advice just sharing what I consider to be one of the best setups on the market!",$REV- The Number 1 Short Squeeze Stock Next Week,2022-08-07
wallstreetbets,[removed],"I have 40k, where should I put it?",2022-08-07
wallstreetbets,,Iron mike gives his blessings to Puts on Disney. Hulu=Disney=📉,2022-08-07
wallstreetbets,,Iron mike gives his blessings to Puts on Disney. Hulu=Disney=📉,2022-08-07
wallstreetbets,Papa Joe and his Inflation Reduction Act lit some candles for energy generation. Is this the transition?,I Found Options,2022-08-07
wallstreetbets,,"Hedgies, please be careful regarding $BBBY. You know the rule: when the shills roll in to WSB, retards sell their $CUM to YOLO on calls. Don’t be left holding your $ASS again…They orchestrated the death of one of our own, Melvin Capital, on Reddit then got us to hold Gabe’s bags. Fuk’em…",2022-08-07
wallstreetbets,,I found options. this is the way,2022-08-07
wallstreetbets,,"Akebia Therapeutics, Inc. (NASDAQ:AKBA) Receives $1.75 Average Price Target from Brokerages",2022-08-07
wallstreetbets,Came across this post on Stocktwits on Friday that apes are starting to go after low float stocks. Pic will be uploaded in comments since visual mods are super gey.,Low floats squeezing?,2022-08-07
wallstreetbets,[removed],I Have $1k To Invest - Genius Ideas?,2022-08-07
wallstreetbets,"

Came across this screenshot on stocktwits the other night. Are we buying/pumping low floats? Ape hungry 🍌",Low Floats SquEEzing?,2022-08-07
wallstreetbets,Came across this screenshot on stocktwits the other night. Are we buying/pumping low floats? Ape hungry 🍌,Low floats squeezing?,2022-08-07
wallstreetbets,,Hey boys💕 who wants a special gift?,2022-08-07
wallstreetbets,,"RIP, done with options, only investing in SPY. Gambling isn’t cool.",2022-08-07
wallstreetbets,[removed],who do you know who is an expert trading Crude Oil cfds?,2022-08-07
wallstreetbets,"Education should be FREE. I am so sick of the world THEY built. We're supposed to be helping each other to be better. The whole system is stupid.

I'm lying here watching Ru Paul's Drag Race and I'm like what in the fuck are we doing? As a ""society"", we shouldn't give a shit what you do, who cares, they do, fuck you, hate you, it's all so stupid. They MAKE us stupid on purpose. Get educated.

But we can't. THEY have rigged the education system to be EXPENSIVE, it's on purpose. We are too stupid to see the whole system is riXYed for the .01. THEY are riXYing the markets, it's so fucking obvious.

Disclaimer: I'm very stoned. It brings out my emotions but what but in the fuck. Education should be free. We're too stupid to see that climate change is happening, right? That's also obvious because IT'S ALWAYS SO FUCKING hot right? But no. We're too stupid. I can tell it's hot, and half the country is too stupid to see it.

And when I say stupid I really mean they haven't seen through beyond what is keeping themselves to get educated. In general.

I'YOLO'ed into GameStop that January, $289 ape. The community that the ticker #GME has brought from around the world for the last year and a half plus is extraordinary. We're so MUCH FUCKING smarter now, it's education. We are so dumb.

The DD is never done, AND the DD has proved 1000's of crimes, it's so fucking obvious. WE own this, it is inevitable. Or THEY take it away. Like they always have, through inflation? Some other disease? 

Is Ryan Cohen the man? He's doing what's best for the long term view for his company. WE as the #GME community have them trapped. It's so obvious. First time in history? #GMEANGRY",#GMEANGRY,2022-08-07
wallstreetbets,"This ipo started at 4$ last week ( friday i think) 
Up 2,325% ppl still saying its gonna rocket on Monday.. 97% after hours. Only 5 million shares outstanding. Good lick getting your orders filled.",$MEGL Magic Global Empire LTD,2022-08-07
wallstreetbets,What are the best penny cryptocurrencies to invest into? Market is in an interesting place right now and I’d love to get some knowledge from people who know more than myself. Would appreciate any advice,Help me quit my job and be rich lol,2022-08-07
wallstreetbets,[removed],Is $ZYNE something to look at for options,2022-08-07
wallstreetbets,,Thug Life 💰,2022-08-07
wallstreetbets,[removed],Best penny cryptocurrency to invest into?,2022-08-07
wallstreetbets,,Dibs on the Wife,2022-08-07
wallstreetbets,,"Lmao if ya know , ya know... still buying a few shares monday though.",2022-08-07
wallstreetbets,"Like title says, thanks to a reasonably high paying career and selling my house only 3 years after buying it for frankly way too much profit, I've got some change set aside. I'm early 20s and pretty good career prospects so I'm thinking fuck it, yolo this shit and retire or just be set back a few years. What you fellas got for me?","Have almost 200k saved up. I'm young and dumb, what's the yolo? BBBY?",2022-08-07
wallstreetbets,,Reaction to the BBBY DD that's being shared,2022-08-07
wallstreetbets,,Data kya hai in Hindi,2022-08-07
wallstreetbets,,yooo 710k where y'all at cuz I'm going in on time,2022-08-07
wallstreetbets,,Some if the things I'm looking out for this coming week.,2022-08-07
wallstreetbets,[removed],Whats the next major play.,2022-08-07
wallstreetbets,[removed],So I have almost 200k saved up. What should I yolo on? What's the play with BBBY?,2022-08-07
wallstreetbets,,Making money is fucking easy,2022-08-07
wallstreetbets,,To the moon 😂🤣😂,2022-08-07
wallstreetbets,,Sell or hold ??,2022-08-07
wallstreetbets,,Bank Hate This One Money Making Trick!!! 💰 🤑 💸,2022-08-07
wallstreetbets,[removed],Saxon James Musk 2.0,2022-08-07
wallstreetbets,,Sale or hold?,2022-08-07
wallstreetbets,My mother (37) gave my access to her bank account that has ~$600 000 in it (life insurance from my dead brother). She is very good with her money and realizes that I’ve found an untapped gold mine. This is literally free money. (It’s free)The reason why it’s called ShitCoin is because it tracks when everyone says the word “shit” everywhere on the internet! This is literally free money. The coin is currently worth $0.0025 per coin meaning I currently have 240 000 000 ShitCoin! You literally cannot lose money since this is the lowest it can go. Invest as much as you possibly can and you will thank me when you’re rich!!!!,"Guys, I (21) invested my mom’s small fortune in ShitCoin!",2022-08-07
wallstreetbets,,"You apes convinced me, I’ll throw $500 into options. I’ve never done options what should I buy?",2022-08-07
wallstreetbets,[removed],Greed is good!!,2022-08-07
wallstreetbets,,"Inspired by many others, I hit a few GameStop’s and got some Switch’s, games, etc to donate to my local Children’s Hospital. Thanks WSB, we like the stock!",2022-08-07
wallstreetbets,,"Fine, you ape’s convinced me to buy BBBY. I’ve never done options, I’ll throw $500 into them. What should i buy?",2022-08-07
wallstreetbets,,Earnings for upcoming week,2022-08-07
wallstreetbets,[removed],LONG $TOST 🍞🚀,2022-08-07
wallstreetbets,,"Apes, please be careful regarding $BBBY. You know the rule: when the YOLO gains have already been posted on WSB, you’ve missed the squeeze. Don’t be left holding the bag again…. They orchestrate these p.umps on private discord servers then get WSB to hold their big bags. Fuk’em….",2022-08-07
wallstreetbets,,Historical Prices of every day goods. # INFLATION,2022-08-07
wallstreetbets,,Unusually High OI on Sept16 $370/$380 puts on the SPY. Is that you 🌈🧸s or do the tutes know something?,2022-08-07
wallstreetbets,,Unusually High OI on Sept16 $370 &amp; $380 puts on the SPY. Is that you 🌈🧸s or do the tutes know something?,2022-08-07
wallstreetbets,,BBBY GME YOLO🚀 Let’s get this party started,2022-08-07
wallstreetbets,[removed],Beware of people in comments trying to talk about how shorting a stock isn’t illegal. It’s a straw man argument that no one is making. They did the same thing with GME in trying to get people to sell off. $BBBY 🚀🚀🚀🌕,2022-08-07
wallstreetbets,"Vivian's Liu promotion from CFO to COO is a good omen prior to earnings EOD Tuesday 8/9

 

My Thesis:

* Tech companies, and specifically meme stocks are seeing strength across the board. 
* Official short interest increased consecutively since May of this year and is now at 58M short shares. 
* WISH resumed ad spend, and even though the total domain traffic is down it is still possible to make money by shedding active users that do not contribute to the bottom line

&amp;#x200B;

[Tits are jacked ](https://preview.redd.it/z8otu8zjc7g91.png?width=175&amp;format=png&amp;auto=webp&amp;s=e7be43b13f7b50ad1c880d7122bccf7649a066a4)

sources: 

* [https://sec.report/Document/0000950170-22-014408/](https://sec.report/Document/0000950170-22-014408/)
* [https://www.nasdaq.com/market-activity/stocks/wish/short-interest](https://www.nasdaq.com/market-activity/stocks/wish/short-interest)
* [https://www.semrush.com/analytics/overview/?q=wish.com&amp;searchType=domain&amp;device=mobile&amp;db=us](https://www.semrush.com/analytics/overview/?q=wish.com&amp;searchType=domain&amp;device=mobile&amp;db=us)

 

&amp;#x200B;

""On July 29, 2022, the Company appointed Vivian Liu as Chief Operating Officer with such appointment to be effective immediately. Ms. Liu will also continue in her role as Chief Financial Officer, which she has held since November 2021. Ms. Liu’s current compensation will remain the same.

Prior to taking on these roles, Ms. Liu, age 47, served as Chief Financial Officer and Senior Vice President of Shutterfly, Inc. from April 2020 until November 2021. Prior to her role at Shutterfly, Ms. Liu served as Chief Financial Officer and Senior Vice President of Lexmark International from July 2017 until April 2020 and Vice President of Finance, Enterprise BG at Huawei Technology Inc. from October 2016 until June 2017. Earlier in her career, Ms. Liu also served in various positions at Cisco Systems, Inc., Deloitte and Goldman Sachs. Ms. Liu sits on the board of directors of Expensify, an expense management software company. Ms. Liu holds an MBA from the University of Washington and a B.A. in International Finance from Shanghai University of Finance and Economics. She is a chartered financial analyst and a certified public accountant.

There are no family relationships between Ms. Liu and any of the Company’s directors or executive officers, and Ms. Liu does not have any direct or indirect material interest in any transaction required to be disclosed pursuant to Item 404(a) of Regulation S-K.""",$WISH - CFO promoted to COO - tits are jack for Tuesday's EOD earnings,2022-08-07
wallstreetbets,,BBBY GME YOLO🚀 This is only the beginning…,2022-08-07
wallstreetbets,[removed],$SNAP,2022-08-07
wallstreetbets,,Committed to being the best!,2022-08-07
wallstreetbets,,"I just got options trading on my RH, did I discover an infinite money cheat code?",2022-08-07
wallstreetbets,[removed],very new guy,2022-08-07
wallstreetbets,[removed],RBLX,2022-08-07
wallstreetbets,"Hello Friends,

It’s nice to be here with you all. I had a good idea how to make successful trades in the stock market. I was thinking about following a stock and when it has a really bad day to buy it at the end of the day. Then once it goes back up, sell and take the profit. What do you think?

Kind regards,

Roger","Hello, new investor here.",2022-08-07
wallstreetbets,,book me for fun 🥒🥒,2022-08-07
wallstreetbets,,buy the dip,2022-08-07
wallstreetbets,,MEGLadon! Let's take it to $2022 year of the retail traders.. China Ipo Gang! Megladon Gang! Let's get this MEGL,2022-08-07
wallstreetbets,I was just gifted a lot of money from a class action lawsuit involving Ball Park Franks. Looking to invest this money wisely so that I could one day get some more packages of Ball Park Franks. Any ideas would be greatly appreciated. Franks in advance.,I have $0.63. What should I invest in?,2022-08-07
wallstreetbets,"
Just looking for discussions before we start the fuckery...",An Apes top ten. Anyone else keeping an eye on these???,2022-08-07
wallstreetbets,[removed],New Community for Veru Inc. to replace old one,2022-08-07
wallstreetbets,,The Journal just reposted this...short seller panic confirmed!!! Bankruptcy by corporate media..,2022-08-07
wallstreetbets,,The Journal just reposted this...short seller panic confirmed!!! Bankruptcy by corporate media,2022-08-07
wallstreetbets,,Future For $BBBY Investor’s,2022-08-07
wallstreetbets,,Melissa Hoffman (@montanaskigirl) on Instagram • 0 photos and videos,2022-08-07
wallstreetbets,,What’s going on with Hyzon? Any chance of getting delisted? Let’s make something happen,2022-08-07
wallstreetbets,"So many wondered why this rally happened after so much bad economic news.

While everyone has their own versions it is really hard to say one factor led to this rally.
I think the main reason is neither the short covering nor the retail or institution buying. 
Japan started buying US and Canadian bonds 3-4 weeks back when SPY was around 380 that started the fuel for rally and later short covering led to this impressive rally.
Even option market is not able to predict this move in the market as implied moves are all over the place past few weeks.
Now why would Japan start buying Bonds suddenly. Do they think bottom is in. Answer is no. They do not care about bottom or top. They are just putting their money in the safe place in case of total economy collapse. In the event of huge crash US/ Canadian economy will recover the fastest. Hence the buying of bonds.
And the thing about top/bottom of market is that absolutely no one can predict those things. They will happen without anyone knowing it.
So now what to do with the money in this market. Scalping and small gains is the key to survive these uncertain market conditions.

TLDR :- The bottom and top of market happens when no one expects them. So do not believe in imminent crash or that bottom is in.Scalping is the safest option if you are not a long term investor.",My DD about recent Rally!,2022-08-07
wallstreetbets,[removed],Come on $BBBY just 🚀🚀🚀🚀🚀. I've missed out on other opportunities prior to this. Hopefully this time I get lucky since I got in on this journey early. 🙏🏻🙏🏻🙏🏻,2022-08-07
wallstreetbets,Let’s pump AMC to the moon!!!,AMC to the moon!,2022-08-07
wallstreetbets,,Which one of you degenerates is responsible for this?,2022-08-07
wallstreetbets,"I dont know shit about fuck. But i have $500 every month to invest. Someone recommended throwing it into coke (coca-cola) not the white dust. They said something about it being a safe investment with dividends. Any other you recommend (safe and with dividends)? 

Thank you!",$500 a month to invest,2022-08-07
wallstreetbets,"Long holder here. Not sure why little attention has been made of this AdTech stock. They have earnings coming up and have a price target of $5.50. They currently trade just above $2. 

They are also are a diverse company they specialize in servicing black owned business and campaigns and the CEO and most the executive are also diverse.

Not sure why so little attention has been made but be curious to hear peoples thoughts.",Don’t Sleep on $DRCT,2022-08-07
wallstreetbets,,FOMO in 4 easy steps 🚀🚀🚀,2022-08-07
wallstreetbets,"When you all make decisions do yall just go straight to filings with the SEC? I normally skim the words, and just look at the numbers cause there so long",question,2022-08-07
wallstreetbets,"🍁Arabian Kush🍁

&amp;#x200B;

Just launched gem in defi BSC, ape now as early as you can.

✅WEBSITE LAUNCHED [www.arabiankush.online](https://www.arabiankush.online)

✅TWITTER READY

✅COMMUNITY READY

&amp;#x200B;

💰Tax 8%

💎Max Tx 30k

&amp;#x200B;

OWNERSHIP RENNOUNCED

LOCKED FOR 1 YEAR

\#BSCGEMS #BSCGems #BSCGEMAlerts #X1000GEMS #DefiGem",🍁Arabian Kush🍁,2022-08-07
wallstreetbets,[removed],Pretty fuckin stoked for asts,2022-08-07
wallstreetbets,[removed],Arabian Kush BSC GEM,2022-08-07
wallstreetbets,,FOMO in 4 easy steps 🚀🚀🚀,2022-08-07
wallstreetbets,[removed],Who else is excited for $BBBY! Can't wait!🚀🚀🚀🚀🚀🚀🚀,2022-08-07
wallstreetbets,[removed],What’s going on with Hyzon? Any chance of delisting? Let’s make something happen,2022-08-07
wallstreetbets,,WallStreet Apes when BBBY Moons on Monday… 🚀🌙💰,2022-08-07
wallstreetbets,[removed],What’s going on with Hyzon? Any chance of delisting?,2022-08-07
wallstreetbets,,FOMO in 4 easy steps…On this MEGL 🚀,2022-08-07
wallstreetbets,[removed],$CEAD.. your welcome guys!!,2022-08-07
wallstreetbets,[removed],Let’s make something happen with Hyzon,2022-08-07
wallstreetbets,[removed],Any interest in Hyzon???,2022-08-07
wallstreetbets,[removed],Hyzon,2022-08-07
wallstreetbets,,How I honestly feel about all you Gay Ass BBBY Bulls… 😡🏳️‍🌈🏳️‍⚧️,2022-08-07
wallstreetbets,,💎🙌,2022-08-07
wallstreetbets,"Honestly, I have been seeing more and more of these …”tell me what to do buy ” and getting  messages asking what do I need to do to “see the signals” I have no friggin clue but never have I seen so many posts asking people to TELL them what to buy. There’s a difference in posting DD or news on stocks you like and invest but all this “TELL ME” seems suspicious",Huh??,2022-08-07
